{
  "author_id": "raymond-carver",
  "run": {
    "model": "gpt-5.6-terra",
    "reasoning_effort": "low",
    "executed_at": "2026-07-21T16:00:00Z",
    "search_rounds": 4
  },
  "candidates": [
    {
      "drink_name_candidate": "Gin tonic",
      "relationship_type_candidate": "appears_in_work",
      "work_candidate": "What We Talk About When We Talk About Love",
      "claim_candidate": "Cuatro personajes beben ginebra con agua tónica mientras conversan alrededor de una mesa de cocina.",
      "why_it_matters": "La bebida, sus componentes y los personajes aparecen desde el inicio del cuento. La relación es narrativa y no acredita consumo ni preferencia de Carver.",
      "confidence_candidate": "high",
      "sources": [
        {
          "url": "https://tnsatlanta.org/wp-content/uploads/What-We-Talk-About-When-We-Talk-About-Love-Carver.pdf",
          "title": "What We Talk About When We Talk About Love",
          "author_or_publisher": "Raymond Carver / Tennessee Northside Association",
          "publication_date": "1981-01-01",
          "source_tier_candidate": "primary",
          "support_excerpt": "The gin and the tonic water kept going around.",
          "locator": "página 1 del PDF, párrafo inicial",
          "accessed_at": "2026-07-21"
        }
      ],
      "contradicting_evidence": [],
      "verification_notes": [
        "Confirmar una edición autorizada y su paginación antes de cualquier promoción.",
        "Mantener explícito que los bebedores son personajes del cuento, no el autor.",
        "No usar la escena para romantizar ni diagnosticar a los personajes."
      ],
      "status": "candidate_generated"
    },
    {
      "drink_name_candidate": "Scotch con agua",
      "relationship_type_candidate": "appears_in_work",
      "work_candidate": "Cathedral",
      "claim_candidate": "El narrador prepara tres vasos grandes de Scotch, cada uno con un poco de agua, para él, su esposa y Robert.",
      "why_it_matters": "El cuento identifica una bebida concreta, su dilución y la acción del narrador. No establece una práctica biográfica de Carver.",
      "confidence_candidate": "high",
      "sources": [
        {
          "url": "https://eclass.uoa.gr/modules/document/file.php/ENL216/TEXTS/cathedral%20text.pdf",
          "title": "Cathedral",
          "author_or_publisher": "Raymond Carver / National and Kapodistrian University of Athens",
          "publication_date": "1981-01-01",
          "source_tier_candidate": "primary",
          "support_excerpt": "three big glasses of Scotch with a splash of water",
          "locator": "página 5 del PDF",
          "accessed_at": "2026-07-21"
        }
      ],
      "contradicting_evidence": [],
      "verification_notes": [
        "Comprobar texto y localizador en una edición autorizada antes de aprobar.",
        "Atribuir la preparación al narrador y no a Raymond Carver."
      ],
      "status": "candidate_generated"
    },
    {
      "drink_name_candidate": "Old Crow",
      "relationship_type_candidate": "appears_in_work",
      "work_candidate": "The Retreat from Moscow",
      "claim_candidate": "El hablante del poema declara que viaja con su hermano y bebe de una pinta de Old Crow.",
      "why_it_matters": "Incorpora una bebida de marca en un poema de Carver, pero la voz poética no debe confundirse automáticamente con una declaración biográfica del autor.",
      "confidence_candidate": "medium",
      "sources": [
        {
          "url": "https://www-s3-live.kent.edu/s3fs-root/s3fs-public/file/I1-Sorby-Temperance-Tradition.pdf?VersionId=bfpwKYCtDDoCjirsh.0YHrkyR9nnB8Y4",
          "title": "Raymond Carver's Poetry and the Temperance Tradition",
          "author_or_publisher": "Angela Sorby / The Raymond Carver Review",
          "publication_date": null,
          "source_tier_candidate": "scholarly",
          "support_excerpt": "drinking from a pint of Old Crow",
          "locator": "páginas 24-25 del PDF, discusión de “The Retreat from Moscow”",
          "accessed_at": "2026-07-21"
        },
        {
          "url": "https://books.google.com/books/about/Fires.html?id=XuEOAQAAMAAJ",
          "title": "Fires: Essays, Poems, Stories",
          "author_or_publisher": "Raymond Carver / Capra Press",
          "publication_date": "1983-01-01",
          "source_tier_candidate": "primary",
          "support_excerpt": "",
          "locator": "ficha bibliográfica; no permite localizar el poema",
          "accessed_at": "2026-07-21"
        }
      ],
      "contradicting_evidence": [
        {
          "claim": "La fuente académica trata la voz del poema como construcción literaria; no prueba que Carver bebiera Old Crow.",
          "source_tier_candidate": "scholarly",
          "accessed_at": "2026-07-21"
        }
      ],
      "verification_notes": [
        "Localizar “The Retreat from Moscow” en una edición verificable para confirmar colección, página y texto completo.",
        "No promover como consumo documentado de Carver ni como recomendación biográfica."
      ],
      "status": "candidate_generated"
    },
    {
      "drink_name_candidate": "Opción sin alcohol no especificada",
      "relationship_type_candidate": "abstinence_or_recovery",
      "work_candidate": null,
      "claim_candidate": "En una entrevista de 1983, Carver describió haber dejado de beber y rechazó que el alcohol hubiera sido una inspiración para su obra.",
      "why_it_matters": "La sobriedad es un contexto biográfico relevante, pero la fuente no recomienda ni nombra una bebida sin alcohol. Cualquier alternativa concreta requerirá una decisión editorial independiente y claramente rotulada.",
      "confidence_candidate": "medium",
      "sources": [
        {
          "url": "https://www.theparisreview.org/interviews/3059/the-art-of-fiction-no-76-raymond-carver",
          "title": "The Art of Fiction No. 76: Raymond Carver",
          "author_or_publisher": "Mona Simpson, Lewis Buzbee / The Paris Review",
          "publication_date": "1983-01-01",
          "source_tier_candidate": "primary",
          "support_excerpt": "I began getting off work at night and going drinking instead of going home.",
          "locator": "entrevista, sección biográfica; la parte sobre recuperación está restringida y debe verificarse en la edición completa",
          "accessed_at": "2026-07-21"
        },
        {
          "url": "https://www-s3-live.kent.edu/s3fs-root/s3fs-public/file/I1-Sorby-Temperance-Tradition.pdf?VersionId=bfpwKYCtDDoCjirsh.0YHrkyR9nnB8Y4",
          "title": "Raymond Carver's Poetry and the Temperance Tradition",
          "author_or_publisher": "Angela Sorby / The Raymond Carver Review",
          "publication_date": null,
          "source_tier_candidate": "scholarly",
          "support_excerpt": "Carver also affirmed the remoteness of his past drinking self.",
          "locator": "página 16 del PDF",
          "accessed_at": "2026-07-21"
        }
      ],
      "contradicting_evidence": [],
      "verification_notes": [
        "Abrir o consultar una copia autorizada completa de la entrevista antes de aprobar fecha, formulación o cualquier detalle de recuperación.",
        "No convertir la sobriedad en estética de marca ni en una receta atribuida a Carver.",
        "No afirmar que alcohol inspiró su obra: la entrevista citada lo rechaza explícitamente, pero esa respuesta debe verificarse en el texto completo."
      ],
      "status": "candidate_generated"
    }
  ],
  "queries_used": [
    "Raymond Carver \"Where I'm Calling From\" \"gin\" text",
    "Raymond Carver \"Where I'm Calling From\" \"drink\" full text",
    "Raymond Carver sobriety 1977 essay \"On Writing\" source",
    "Raymond Carver poem alcohol drink text",
    "site:theparisreview.org Raymond Carver interview alcohol last year drinking recovery center",
    "Raymond Carver interview Paris Review \"My God, No\" alcohol",
    "Raymond Carver \"What We Talk About When We Talk About Love\" gin text PDF",
    "Raymond Carver \"Cathedral\" \"whiskey\" full text",
    "The Art of Fiction No. 76 Raymond Carver Paris Review 1983",
    "Raymond Carver collection Fires poem \"Vodka\" publisher",
    "Raymond Carver \"Vodka\" poem source collection",
    "Raymond Carver \"The Retreat from Moscow\" \"Old Crow\""
  ],
  "unresolved_questions": [
    "¿Qué edición autorizada permite fijar los localizadores de los cuentos antes de cualquier promoción?",
    "¿En qué libro y página verificables aparece “The Retreat from Moscow”, y coincide el texto con la cita académica?",
    "¿La entrevista íntegra de The Paris Review permite verificar directamente la formulación y fecha de sobriedad sin depender de reproducciones secundarias?",
    "¿Debe la ficha final priorizar una escena narrativa y ofrecer una alternativa sin alcohol editorial, en vez de usar la recuperación como una bebida?"
  ],
  "stop_reason": "Se completaron cuatro rondas de búsqueda. Se conservan cuatro candidatos sin aprobación ni publicación; dos escenas de cuentos requieren cotejo en edición autorizada, el candidato poético requiere localizador primario y el de recuperación no nombra una bebida concreta."
}
