{
  "author_id": "julio-cortazar",
  "run": {
    "model": "gpt-5.6-terra",
    "reasoning_effort": "low",
    "executed_at": "2026-07-21T05:15:00Z",
    "search_rounds": 4
  },
  "candidates": [
    {
      "drink_name_candidate": "Café",
      "relationship_type_candidate": "appears_in_work",
      "work_candidate": "Rayuela",
      "claim_candidate": "En el capítulo 3 de Rayuela, Horacio Oliveira y la Maga pasan la tarde y la noche leyendo y escuchando discos, levantándose alternativamente para calentar café o cebar mate.",
      "why_it_matters": "La escena relaciona café, mate, música y conversación nocturna en la novela. Describe acciones de personajes y no prueba un hábito ni una preferencia de Julio Cortázar.",
      "confidence_candidate": "high",
      "sources": [
        {
          "url": "https://cortazar.com.ar/rayuela-capitulo-3/",
          "title": "Rayuela – Capítulo 3",
          "author_or_publisher": "Julio Cortázar / Cortázar",
          "publication_date": null,
          "source_tier_candidate": "primary",
          "support_excerpt": "levantándose alternativamente para calentar café o cebar mate",
          "locator": "Capítulo 3, primer párrafo.",
          "accessed_at": "2026-07-21"
        }
      ],
      "contradicting_evidence": [],
      "verification_notes": [
        "Cotejar el pasaje en una edición autorizada de Rayuela y registrar ISBN, página y editorial antes de promover.",
        "No atribuir el café ni el mate a un consumo documentado de Cortázar."
      ],
      "status": "candidate_generated"
    },
    {
      "drink_name_candidate": "Mate",
      "relationship_type_candidate": "appears_in_work",
      "work_candidate": "Rayuela",
      "claim_candidate": "En el capítulo 41 de Rayuela, Oliveira contrapone el mate que quería tomar con el café con leche asociado a otra hora del día.",
      "why_it_matters": "El pasaje nombra ambas bebidas y construye una oposición de ritual y horario desde la voz de un personaje. No autoriza inferir una preferencia biográfica del autor.",
      "confidence_candidate": "high",
      "sources": [
        {
          "url": "https://www.fder.edu.uy/sites/default/files/2020-09/rayuela.pdf",
          "title": "Rayuela",
          "author_or_publisher": "Julio Cortázar / Facultad de Derecho, Universidad de la República",
          "publication_date": null,
          "source_tier_candidate": "primary",
          "support_excerpt": "No te hablo del mate mal tomado, superpuesto al café con leche",
          "locator": "Capítulo 41; cotejar página en una edición autorizada.",
          "accessed_at": "2026-07-21"
        }
      ],
      "contradicting_evidence": [],
      "verification_notes": [
        "La copia digital localizada sirve para descubrimiento; verificar la edición autorizada y un localizador estable antes de promover.",
        "Aclarar que quien expresa el deseo de mate es Oliveira, no Cortázar."
      ],
      "status": "candidate_generated"
    },
    {
      "drink_name_candidate": "Coñac",
      "relationship_type_candidate": "appears_in_work",
      "work_candidate": "Rayuela",
      "claim_candidate": "El catálogo lingüístico del Instituto Cervantes registra en Rayuela la frase «se había tomado ella sola más de media botella de coñac».",
      "why_it_matters": "La fuente institucional confirma una aparición identificable de coñac en la novela, atribuida a un personaje femenino no identificado en el extracto. El contexto aún es insuficiente para una recomendación editorial.",
      "confidence_candidate": "medium",
      "sources": [
        {
          "url": "https://cvc.cervantes.es/lengua/agle/GestionObras.asp?IdObra=1205&IdSolapa=T&PageNumber=8&num=6&submitBuscar=NOK",
          "title": "AGLE - Obras: Rayuela",
          "author_or_publisher": "Instituto Cervantes",
          "publication_date": null,
          "source_tier_candidate": "scholarly",
          "support_excerpt": "se había tomado ella sola más de media botella de coñac",
          "locator": "Registro 66584 de citas asociadas a Rayuela; la ficha no informa capítulo ni página.",
          "accessed_at": "2026-07-21"
        }
      ],
      "contradicting_evidence": [],
      "verification_notes": [
        "Localizar el pasaje completo en una edición autorizada para identificar personaje, capítulo y contexto antes de promover.",
        "La cantidad de alcohol narrada exige evaluar contexto y tono; no usarla como recomendación celebratoria ni como rasgo del autor."
      ],
      "status": "candidate_generated"
    },
    {
      "drink_name_candidate": "Whisky",
      "relationship_type_candidate": "author_documented",
      "work_candidate": null,
      "claim_candidate": "Una reseña no institucional de la entrevista A fondo (1977) afirma que Cortázar se acerca repetidamente a un vaso de whisky durante la conversación; el video original está disponible en RTVE.",
      "why_it_matters": "Es una anécdota audiovisual localizable, pero no demuestra qué contenía el vaso, cuánto bebió ni que el whisky fuese una preferencia. Se conserva como pista de baja confianza y con riesgo de mito.",
      "confidence_candidate": "low",
      "sources": [
        {
          "url": "https://www.rtve.es/play/videos/a-fondo/julio-cortazar/1051583/",
          "title": "A fondo - Julio Cortázar",
          "author_or_publisher": "RTVE; entrevista de Joaquín Soler Serrano",
          "publication_date": "1977-03-20",
          "source_tier_candidate": "primary",
          "support_excerpt": "",
          "locator": "Video completo, 2:02:21; revisar visualmente el vaso y fijar minuto antes de cualquier uso.",
          "accessed_at": "2026-07-21"
        },
        {
          "url": "https://www.altafidelidad.org/julio-cortazar-en-a-fondo/",
          "title": "Julio Cortázar en A Fondo",
          "author_or_publisher": "AltaFidelidad.org",
          "publication_date": null,
          "source_tier_candidate": "discovery_only",
          "support_excerpt": "constantes acercamientos al vaso de whisky",
          "locator": "Párrafo de presentación de la entrevista.",
          "accessed_at": "2026-07-21"
        }
      ],
      "contradicting_evidence": [
        {
          "claim": "La fuente primaria disponible identifica la entrevista, pero su ficha no transcribe ni identifica el contenido del vaso; la atribución de whisky procede de una reseña de descubrimiento.",
          "sources": [
            {
              "url": "https://www.rtve.es/play/videos/a-fondo/julio-cortazar/1051583/",
              "title": "A fondo - Julio Cortázar",
              "author_or_publisher": "RTVE; entrevista de Joaquín Soler Serrano",
              "publication_date": "1977-03-20",
              "source_tier_candidate": "primary",
              "support_excerpt": "",
              "locator": "Ficha técnica y video; sin transcripción de la bebida.",
              "accessed_at": "2026-07-21"
            }
          ]
        }
      ],
      "verification_notes": [
        "Marcar myth_risk: una imagen o reseña de entrevista no demuestra preferencia ni consumo habitual.",
        "Revisar el video original, anotar minuto y comprobar si se identifica inequívocamente la bebida; buscar además una fuente independiente de nivel A, B o C.",
        "No promover ni describir el whisky como bebida favorita de Cortázar con la evidencia actual."
      ],
      "status": "candidate_generated"
    }
  ],
  "queries_used": [
    "\"Rayuela\" \"whisky\" Cortázar",
    "\"Rayuela\" \"café\" Cortázar capítulo",
    "Julio Cortázar entrevista bebida café bar",
    "Julio Cortázar cartas café vino",
    "\"Rayuela\" \"whisky\" \"Cortázar\" \"capítulo\"",
    "\"Rayuela\" \"mate\" \"café con leche\" \"capítulo 41\"",
    "\"Rayuela\" \"moka\" \"café\" capítulo 28",
    "site:cervantes.es Cortázar Rayuela café whisky",
    "Julio Cortázar A fondo Soler Serrano whisky entrevista RTVE",
    "Julio Cortázar \"whisky\" entrevista",
    "Julio Cortázar cartas \"whisky\"",
    "Julio Cortázar \"café\" cartas entrevista",
    "site:cortazar.com.ar Rayuela coñac",
    "site:cortazar.com.ar Rayuela \"mate\"",
    "site:cortazar.com.ar Rayuela \"café con leche\"",
    "site:cvc.cervantes.es Julio Cortázar Rayuela bebidas café coñac"
  ],
  "unresolved_questions": [
    "¿Qué edición autorizada de Rayuela permite fijar páginas e ISBN para los capítulos 3 y 41 y para el pasaje de coñac?",
    "¿Qué personaje aparece en la escena del coñac y cuál es el contexto narrativo completo?",
    "¿El video de RTVE permite identificar de manera inequívoca el contenido del vaso, y existe una fuente independiente que documente consumo de whisky por Cortázar?",
    "¿Hay cartas o entrevistas primarias que documenten una bebida concreta como hábito o preferencia sin depender de anécdotas?"
  ],
  "stop_reason": "Se completaron cuatro rondas de búsqueda. Se conservan cuatro candidatos sin aprobación ni publicación: tres apariciones textuales en Rayuela y una anécdota audiovisual de whisky marcada con myth_risk y confianza baja. No se encontró evidencia suficiente para atribuir una bebida favorita a Julio Cortázar."
}
