{
  "author_id": "raymond-chandler",
  "run": {
    "model": "gpt-5.6-terra",
    "reasoning_effort": "low",
    "executed_at": "2026-07-21T04:15:32Z",
    "search_rounds": 4
  },
  "candidates": [
    {
      "drink_name_candidate": "Gimlet",
      "relationship_type_candidate": "appears_in_work",
      "work_candidate": "The Long Goodbye",
      "claim_candidate": "Philip Marlowe y Terry Lennox beben gimlets en Victor's; Lennox describe allí un gimlet como ginebra y Rose's Lime Juice a partes iguales.",
      "why_it_matters": "La bebida articula encuentros repetidos entre Marlowe y Lennox, por lo que es una relación narrativa concreta y no una inferencia sobre los hábitos de Chandler.",
      "confidence_candidate": "high",
      "sources": [
        {
          "url": "https://gutenberg.ca/ebooks/chandlerr-longgoodbye/chandlerr-longgoodbye-00-h.html",
          "title": "The Long Goodbye",
          "author_or_publisher": "Raymond Chandler / Project Gutenberg Canada",
          "publication_date": null,
          "source_tier_candidate": "primary",
          "support_excerpt": "We sat in a corner of the bar at Victor's and drank gimlets.",
          "locator": "Capítulo 3; el índice de búsqueda de la edición digital muestra el pasaje.",
          "accessed_at": "2026-07-21"
        },
        {
          "url": "https://laist.com/news/entertainment/gimlet-like-raymond-chandler",
          "title": "How To Make A Gimlet Like Raymond Chandler",
          "author_or_publisher": "Julia Wick, LAist",
          "publication_date": "2017-03-19",
          "source_tier_candidate": "reputable_secondary",
          "support_excerpt": "Terry Lennox ... introduces Marlowe to gimlets in The Long Goodbye.",
          "locator": "Párrafos sobre Terry Lennox y el gimlet.",
          "accessed_at": "2026-07-21"
        }
      ],
      "contradicting_evidence": [],
      "verification_notes": [
        "Abrir una edición verificable de la novela para confirmar el texto y el capítulo antes de promover.",
        "No describir el gimlet como bebida favorita de Chandler a partir de esta evidencia de ficción."
      ],
      "status": "candidate_generated"
    },
    {
      "drink_name_candidate": "Brandy con soda",
      "relationship_type_candidate": "appears_in_work",
      "work_candidate": "The Big Sleep",
      "claim_candidate": "En la primera entrevista con el general Sternwood, Norris sirve a Philip Marlowe un brandy con soda.",
      "why_it_matters": "Es una bebida servida explícitamente a Marlowe en una escena inicial de la novela; no prueba una preferencia del personaje ni del autor.",
      "confidence_candidate": "medium",
      "sources": [
        {
          "url": "https://www.penguinrandomhouse.ca/books/26040/the-big-sleep-by-raymond-chandler/9780394758282/excerpt",
          "title": "Excerpt from The Big Sleep",
          "author_or_publisher": "Raymond Chandler / Penguin Random House Canada",
          "publication_date": null,
          "source_tier_candidate": "primary",
          "support_excerpt": "Then the butler came ... mixed me a brandy and soda.",
          "locator": "Extracto oficial, escena de la conversación inicial con el general Sternwood.",
          "accessed_at": "2026-07-21"
        }
      ],
      "contradicting_evidence": [],
      "verification_notes": [
        "Confirmar capítulo y edición paginada antes de promoción.",
        "La fuente también atribuye al general Sternwood brandy con champaña; no confundir esa preferencia del general con la bebida de Marlowe."
      ],
      "status": "candidate_generated"
    },
    {
      "drink_name_candidate": "Gin gimlet",
      "relationship_type_candidate": "author_documented",
      "work_candidate": null,
      "claim_candidate": "Una fuente periodística atribuye a Chandler el consumo de gin gimlets durante sus últimos años y lo llama su bebida de elección.",
      "why_it_matters": "Podría respaldar un vínculo biográfico directo, pero la afirmación requiere revisión de la fuente historiográfica citada antes de cualquier uso editorial.",
      "confidence_candidate": "low",
      "sources": [
        {
          "url": "https://laist.com/news/entertainment/gimlet-like-raymond-chandler",
          "title": "How To Make A Gimlet Like Raymond Chandler",
          "author_or_publisher": "Julia Wick, LAist",
          "publication_date": "2017-03-19",
          "source_tier_candidate": "reputable_secondary",
          "support_excerpt": "Gimlets were also Chandler's personal drink of choice, according to California historian Kevin Starr.",
          "locator": "Párrafos que atribuyen la afirmación a Kevin Starr y Golden Dreams.",
          "accessed_at": "2026-07-21"
        },
        {
          "url": "https://www.theguardian.com/p/xecbz",
          "title": "Famous drinkers: Raymond Chandler",
          "author_or_publisher": "The Guardian",
          "publication_date": null,
          "source_tier_candidate": "reputable_secondary",
          "support_excerpt": "When he drank (gimlets were a favourite) Chandler suffered blackouts.",
          "locator": "Texto de la nota; fecha y autor deben verificarse en la página original.",
          "accessed_at": "2026-07-21"
        }
      ],
      "contradicting_evidence": [
        {
          "claim": "La asociación del gimlet con Chandler puede provenir de The Long Goodbye y de Philip Marlowe, no necesariamente de una preferencia biográfica comprobada.",
          "sources": [
            {
              "url": "https://laist.com/news/entertainment/gimlet-like-raymond-chandler",
              "title": "How To Make A Gimlet Like Raymond Chandler",
              "author_or_publisher": "Julia Wick, LAist",
              "publication_date": "2017-03-19",
              "source_tier_candidate": "reputable_secondary",
              "support_excerpt": "Despite the drink's strong association with Chandler, the gimlet is only introduced in ... The Long Goodbye.",
              "locator": "Párrafo sobre la asociación cultural del gimlet.",
              "accessed_at": "2026-07-21"
            }
          ]
        }
      ],
      "verification_notes": [
        "Consultar directamente Golden Dreams: California in an Age of Abundance, 1950-1963, de Kevin Starr, y registrar página o sección.",
        "No usar 'favorito' ni presentar una receta histórica hasta confirmar la fuente de Starr y separar vida del autor de la ficción de Marlowe.",
        "Tratar las referencias al deterioro asociado al alcohol con lenguaje no celebratorio."
      ],
      "status": "candidate_generated"
    }
  ],
  "queries_used": [
    "Raymond Chandler The Big Sleep text drinking whisky brandy Marlowe",
    "Raymond Chandler The Long Goodbye text gimlet Terry Lennox",
    "Raymond Chandler drinks biography letters alcohol",
    "site:archive.org Raymond Chandler The Big Sleep full text",
    "\"The Long Goodbye\" \"gimlet\" \"Victor's\" Chandler chapter",
    "\"The Long Goodbye\" \"A real gimlet\" Chandler",
    "\"The Big Sleep\" \"How do you like your brandy\" Chandler chapter",
    "Raymond Chandler \"gimlet\" \"Terry Lennox\"",
    "Judith Freeman The Long Embrace Raymond Chandler \"Rose's\" gimlets",
    "\"Raymond Chandler\" \"Rose's Lime Juice\" biography",
    "Raymond Chandler papers alcohol drinking letters archive",
    "Raymond Chandler biography drinking gin gimlet source",
    "site:gutenberg.ca/ebooks/chandlerr-longgoodbye \"We sat in a corner\"",
    "site:gutenberg.ca/ebooks/chandlerr-longgoodbye \"real gimlet\"",
    "site:archive.org/details \"The Long Goodbye\" Raymond Chandler \"gimlet\"",
    "\"Raymond Chandler\" gimlets \"Rose's lime juice delivered\""
  ],
  "unresolved_questions": [
    "¿Qué página o sección de Golden Dreams sustenta la atribución biográfica del gin gimlet a Chandler?",
    "¿Qué edición paginada de The Long Goodbye permite fijar el localizador del pasaje de Victor's?",
    "¿Qué capítulo de The Big Sleep contiene el extracto de Penguin Random House Canada?"
  ],
  "stop_reason": "Se completaron cuatro rondas de búsqueda. Se conservan tres candidatos; la relación biográfica con el gin gimlet queda deliberadamente en baja confianza hasta consultar su fuente historiográfica primaria o especializada."
}
