{
  "author_id": "juan-carlos-onetti",
  "run": {
    "model": "gpt-5.6-terra",
    "reasoning_effort": "low",
    "executed_at": "2026-07-21T00:00:00Z",
    "search_rounds": 4
  },
  "candidates": [
    {
      "drink_name_candidate": "Whisky",
      "relationship_type_candidate": "author_documented",
      "work_candidate": null,
      "claim_candidate": "En un cuestionario Proust, Onetti definió su sueño de dicha como «Whisky y una buena novela policial que todavía no he leído».",
      "why_it_matters": "Es una asociación formulada por el propio autor entre el whisky y una idea de felicidad ligada a la lectura. No demuestra una marca, una receta ni permite llamarlo su bebida favorita.",
      "confidence_candidate": "medium",
      "sources": [
        {
          "url": "https://elpais.com/diario/2009/06/21/cultura/1245535201_850215.html",
          "title": "Cien años de un genio perezoso",
          "author_or_publisher": "Javier Rodríguez Marcos / El País",
          "publication_date": "2009-06-21",
          "source_tier_candidate": "reputable_secondary",
          "support_excerpt": "¿Su sueño de dicha? Whisky y una buena novela policial que todavía no he leído.",
          "locator": "Párrafo que transcribe el cuestionario Proust de Onetti.",
          "accessed_at": "2026-07-21"
        },
        {
          "url": "https://cvc.cervantes.es/literatura/escritores/onetti/acerca/tocilovac.htm",
          "title": "Cuando entonces: aparece Magda y Onetti existe",
          "author_or_publisher": "Goran Tocilovac / Centro Virtual Cervantes",
          "publication_date": null,
          "source_tier_candidate": "scholarly",
          "support_excerpt": "postrado en la cama con el tabaco y un vaso de whisky al alcance de la mano",
          "locator": "Párrafo 3, evocación de sus años finales en Madrid.",
          "accessed_at": "2026-07-21"
        }
      ],
      "contradicting_evidence": [
        {
          "claim": "La respuesta al cuestionario expresa un ideal de dicha; por sí sola no prueba frecuencia de consumo ni una preferencia exclusiva.",
          "sources": []
        }
      ],
      "verification_notes": [
        "Localizar la publicación original del cuestionario Proust o la edición de obras completas citada por El País antes de una promoción.",
        "Conservar la formulación literal o una paráfrasis prudente; no usar «bebida favorita».",
        "La imagen recurrente del whisky en artículos y fotografías puede ser parte de la leyenda pública de Onetti; no usarla como única prueba."
      ],
      "status": "candidate_generated"
    },
    {
      "drink_name_candidate": "Vino blanco",
      "relationship_type_candidate": "appears_in_work",
      "work_candidate": "El astillero",
      "claim_candidate": "En El astillero, un hombre y dos jóvenes están cerca de una ventana tomando vino blanco.",
      "why_it_matters": "La bebida aparece en una escena de observación dentro de la novela; el estudio que la cita la relaciona con el efecto de espectáculo y teatralidad del mundo del astillero. Concierne a personajes, no al consumo de Onetti.",
      "confidence_candidate": "high",
      "sources": [
        {
          "url": "https://cvc.cervantes.es/literatura/aih/pdf/07/aih_07_2_011.pdf",
          "title": "Caracteres y estructura en El astillero de J. C. Onetti",
          "author_or_publisher": "Katalin Kulin / Asociación Internacional de Hispanistas",
          "publication_date": "1980",
          "source_tier_candidate": "scholarly",
          "support_excerpt": "estaban cerca de una ventana, tomando vino blanco",
          "locator": "p. 650 del PDF; cita atribuida a El astillero, Arca, 1967, p. 80.",
          "accessed_at": "2026-07-21"
        }
      ],
      "contradicting_evidence": [],
      "verification_notes": [
        "Comprobar el pasaje en una edición autorizada de El astillero antes de publicar.",
        "No presentar esta aparición como una preferencia ni un hábito del autor."
      ],
      "status": "candidate_generated"
    },
    {
      "drink_name_candidate": "Cerveza",
      "relationship_type_candidate": "appears_in_work",
      "work_candidate": "Juntacadáveres",
      "claim_candidate": "Díaz Grey toma una cerveza solo junto a la ventana del bar del Plaza.",
      "why_it_matters": "Es una mención explícita, situada y verificable en el Bar del Plaza de Santa María. Puede servir para una recomendación basada en una escena de personaje, sin atribuirla al autor.",
      "confidence_candidate": "high",
      "sources": [
        {
          "url": "https://cvc.cervantes.es/literatura/escritores/onetti/santa_maria/bar_05.htm",
          "title": "Bar del Plaza",
          "author_or_publisher": "Centro Virtual Cervantes",
          "publication_date": null,
          "source_tier_candidate": "scholarly",
          "support_excerpt": "Díaz Grey estaba tomando una cerveza, solo, en la mesa junto a la ventana",
          "locator": "Juntacadáveres, Obras completas, Aguilar, 1970, p. 961.",
          "accessed_at": "2026-07-21"
        }
      ],
      "contradicting_evidence": [],
      "verification_notes": [
        "Confirmar el contexto completo de la página 961 en una edición disponible antes de promover.",
        "No convertir la cerveza de Díaz Grey en una afirmación biográfica sobre Onetti."
      ],
      "status": "candidate_generated"
    },
    {
      "drink_name_candidate": "Caña",
      "relationship_type_candidate": "appears_in_work",
      "work_candidate": "Juntacadáveres",
      "claim_candidate": "En el bar del Plaza, cuatro chicos y una muchachita beben copas de caña o coñac cerca del mostrador.",
      "why_it_matters": "La caña integra una escena colectiva de bar, con un localizador editorial preciso. La fuente conserva una alternativa («o coñac»), por lo que no debe afirmarse cuál de las dos bebidas toma cada personaje.",
      "confidence_candidate": "medium",
      "sources": [
        {
          "url": "https://cvc.cervantes.es/literatura/escritores/onetti/santa_maria/bar_05.htm",
          "title": "Bar del Plaza",
          "author_or_publisher": "Centro Virtual Cervantes",
          "publication_date": null,
          "source_tier_candidate": "scholarly",
          "support_excerpt": "bebían refrescos y copas de caña o coñac, cerca del mostrador",
          "locator": "Juntacadáveres, Obras completas, Aguilar, 1970, p. 961.",
          "accessed_at": "2026-07-21"
        }
      ],
      "contradicting_evidence": [
        {
          "claim": "El pasaje no individualiza si una persona concreta bebe caña o coñac.",
          "sources": []
        }
      ],
      "verification_notes": [
        "Mantener la disyuntiva de la fuente o verificar el pasaje completo antes de seleccionar una bebida única.",
        "Evaluar si la falta de individualización vuelve esta aparición demasiado secundaria para una ficha pública."
      ],
      "status": "candidate_generated"
    }
  ],
  "queries_used": [
    "\"El astillero\" Onetti vino bebida",
    "\"Juntacadáveres\" Onetti vino bebida",
    "\"Juan Carlos Onetti\" entrevista bares bebida",
    "\"Juan Carlos Onetti\" alcohol biografía bares",
    "site:cvc.cervantes.es/literatura/escritores/onetti \"Juntacadáveres\" \"caña\"",
    "site:cvc.cervantes.es/literatura/escritores/onetti \"El astillero\" vino OR whisky OR cerveza",
    "\"Onetti\" \"Whisky y una buena novela policial\"",
    "\"Juan Carlos Onetti\" whisky entrevista cuestionario Proust",
    "\"El astillero\" Onetti \"vino blanco\"",
    "\"El astillero\" Onetti \"tomando vino blanco\"",
    "\"Juan Carlos Onetti\" \"vaso de whisky\" biografía",
    "\"Juan Carlos Onetti\" \"whisky\" \"Cuestionario Proust\"",
    "\"Juan Carlos Onetti\" bar \"Juan Rulfo\" beber",
    "\"Juan Carlos Onetti\" \"gin fizz\"",
    "\"Juan Carlos Onetti\" \"bar\" anécdota whisky",
    "\"Juan Carlos Onetti\" alcohol mito bebida favorita"
  ],
  "unresolved_questions": [
    "¿Dónde se publicó originalmente el cuestionario Proust de Onetti y cuál es su localizador bibliográfico verificable?",
    "¿Qué edición autorizada de El astillero permite cotejar la cita de vino blanco y su página 80?",
    "¿El contexto completo de Juntacadáveres, p. 961, permite identificar con precisión quién bebe caña y quién coñac?",
    "Las anécdotas de Onetti bebiendo con Juan Rulfo en un bar deben tratarse como relatos secundarios hasta localizar una fotografía fechada o un testimonio primario verificable."
  ],
  "stop_reason": "Se completaron cuatro rondas de búsqueda. Se conservan cuatro candidatos sin aprobación: un vínculo biográfico prudente con whisky y tres apariciones de bebidas en El astillero y Juntacadáveres. Las anécdotas de bar con Juan Rulfo se registran sólo como pista pendiente de fuente primaria."
}
