{
  "author_id": "dashiell-hammett",
  "run": {
    "model": "gpt-5.6-terra",
    "reasoning_effort": "low",
    "executed_at": "2026-07-21T04:20:10Z",
    "search_rounds": 3
  },
  "candidates": [
    {
      "drink_name_candidate": "Manhattan",
      "relationship_type_candidate": "appears_in_work",
      "work_candidate": "The Maltese Falcon",
      "claim_candidate": "Sam Spade toma un Manhattan embotellado de un cajón de su escritorio después de reunirse con Joel Cairo.",
      "why_it_matters": "La bebida, el personaje y la acción están identificados expresamente en una escena concreta de la novela; no permite inferir hábitos de Hammett.",
      "confidence_candidate": "high",
      "sources": [
        {
          "url": "https://www.gutenberg.org/files/77600/77600-h/77600-h.htm",
          "title": "The Maltese Falcon",
          "author_or_publisher": "Dashiell Hammett / Project Gutenberg",
          "publication_date": null,
          "source_tier_candidate": "primary",
          "support_excerpt": "took a bottle of Manhattan cocktail and a paper drinking-cup from a desk-drawer",
          "locator": "capítulo 6, \"The Undersized Shadow\"",
          "accessed_at": "2026-07-21"
        }
      ],
      "contradicting_evidence": [],
      "verification_notes": [
        "Comprobar la edición que se citaría públicamente y conservar el capítulo como localizador.",
        "Atribuir el consumo a Sam Spade, no a Dashiell Hammett."
      ],
      "status": "candidate_generated"
    },
    {
      "drink_name_candidate": "Café con brandy",
      "relationship_type_candidate": "appears_in_work",
      "work_candidate": "The Maltese Falcon",
      "claim_candidate": "Brigid O'Shaughnessy y Sam Spade toman café con brandy mientras conversan sobre el halcón.",
      "why_it_matters": "La escena nombra la combinación y muestra a ambos personajes bebiéndola; es una aparición narrativa, no una evidencia biográfica.",
      "confidence_candidate": "high",
      "sources": [
        {
          "url": "https://www.gutenberg.org/files/77600/77600-h/77600-h.htm",
          "title": "The Maltese Falcon",
          "author_or_publisher": "Dashiell Hammett / Project Gutenberg",
          "publication_date": null,
          "source_tier_candidate": "primary",
          "support_excerpt": "She sipped coffee and brandy",
          "locator": "capítulo 9, \"The Third Murder\"",
          "accessed_at": "2026-07-21"
        }
      ],
      "contradicting_evidence": [],
      "verification_notes": [
        "La edición digital también indica que Spade bebe de la misma taza; verificar la presentación exacta antes de publicar.",
        "Normalizar si corresponde como café con brandy, sin convertirlo en un cóctel histórico específico."
      ],
      "status": "candidate_generated"
    },
    {
      "drink_name_candidate": "Martini",
      "relationship_type_candidate": "abstinence_or_recovery",
      "work_candidate": null,
      "claim_candidate": "Lillian Hellman recuerda que Hammett dejó de beber por advertencia médica y exceptúa un martini durante su último año de vida.",
      "why_it_matters": "El testimonio de una persona cercana permite registrar un posible vínculo biográfico, pero el contexto es recuperación y enfermedad, no una preferencia ni una invitación a romantizar el consumo.",
      "confidence_candidate": "medium",
      "sources": [
        {
          "url": "https://www.nybooks.com/articles/1965/11/25/dashiell-hammett-a-memoir/",
          "title": "Dashiell Hammett: A Memoir",
          "author_or_publisher": "Lillian Hellman / The New York Review of Books",
          "publication_date": "1965-11-25",
          "source_tier_candidate": "reputable_secondary",
          "support_excerpt": "he would never have another drink ... except for the last year of the one martini",
          "locator": "párrafo que comienza \"Because on the night we had first met\"",
          "accessed_at": "2026-07-21"
        },
        {
          "url": "https://research.hrc.utexas.edu/fasearch/findingaid.cfm?eadid=00397&showrequest=0",
          "title": "Dashiell Hammett: An Inventory of His Papers at the Harry Ransom Center",
          "author_or_publisher": "Harry Ransom Center, The University of Texas at Austin",
          "publication_date": null,
          "source_tier_candidate": "scholarly",
          "support_excerpt": "increasingly severe alcohol abuse",
          "locator": "Biographical Sketch",
          "accessed_at": "2026-07-21"
        }
      ],
      "contradicting_evidence": [],
      "verification_notes": [
        "La memoria de Hellman es un testimonio personal; revisar la biografía y la cronología antes de promover.",
        "No afirmar que el martini fue favorito de Hammett ni usar esta evidencia para una recomendación alcohólica sin evaluación editorial de recuperación.",
        "Si se promueve el vínculo, considerar una alternativa sin alcohol y lenguaje sobrio."
      ],
      "status": "candidate_generated"
    }
  ],
  "queries_used": [
    "Dashiell Hammett The Thin Man cocktail text drinks Nick Nora source",
    "Dashiell Hammett The Maltese Falcon whiskey cocktail text drinks source",
    "Dashiell Hammett bibliography The Thin Man The Maltese Falcon archive university",
    "Dashiell Hammett drinking biography alcohol documented",
    "\"The Thin Man\" \"whiskey\" Hammett novel",
    "\"The Thin Man\" \"martini\" \"Dashiell Hammett\" novel",
    "\"The Thin Man\" \"cocktail\" \"Dashiell Hammett\" text",
    "\"The Maltese Falcon\" \"Manhattan cocktail\" Hammett",
    "\"Dashiell Hammett\" \"martini\" \"Lillian Hellman\"",
    "\"Dashiell Hammett\" \"Manhattan cocktail\" \"Sam Spade\"",
    "\"Dashiell Hammett\" alcohol biography \"The Thin Man\" scholarly",
    "site:archive.org/details \"The Thin Man\" \"Dashiell Hammett\" 1934"
  ],
  "unresolved_questions": [
    "¿Qué edición verificable de The Thin Man permite localizar una bebida concreta en la novela, separada de sus adaptaciones cinematográficas?",
    "¿Existe una biografía con aparato de fuentes que confirme o matice el recuerdo de Hellman sobre el martini y la abstinencia de Hammett?",
    "¿La publicación editorial debería excluir el candidato de martini y priorizar sólo vínculos narrativos para evitar tratar la recuperación como maridaje?"
  ],
  "stop_reason": "Se cerró tras tres rondas: las consultas posteriores repetían asociaciones de las adaptaciones cinematográficas de The Thin Man o fuentes de descubrimiento. Se conservaron tres candidatos trazables y no se aprobó ni publicó ninguno."
}
