{
  "author_id": "edgar-allan-poe",
  "run": {
    "model": "gpt-5.6-terra",
    "reasoning_effort": "low",
    "executed_at": "2026-07-21T04:29:42Z",
    "search_rounds": 4
  },
  "candidates": [
    {
      "drink_name_candidate": "Amontillado",
      "relationship_type_candidate": "appears_in_work",
      "work_candidate": "The Cask of Amontillado",
      "claim_candidate": "Montresor atrae a Fortunato a las catacumbas con la promesa de examinar una pipa de amontillado; Fortunato afirma poder distinguirlo del jerez.",
      "why_it_matters": "El vino es el señuelo que organiza la acción del cuento y la bebida está identificada de forma explícita; esta evidencia concierne a los personajes, no a los hábitos de Poe.",
      "confidence_candidate": "high",
      "sources": [
        {
          "url": "https://www.gutenberg.org/cache/epub/1063/pg1063-images.html",
          "title": "The Cask of Amontillado",
          "author_or_publisher": "Edgar Allan Poe / Project Gutenberg",
          "publication_date": null,
          "source_tier_candidate": "primary",
          "support_excerpt": "I have received a pipe of what passes for Amontillado, and I have my doubts.",
          "locator": "Texto digital, párrafos iniciales: conversación entre Montresor y Fortunato antes de bajar a las bóvedas.",
          "accessed_at": "2026-07-21"
        }
      ],
      "contradicting_evidence": [],
      "verification_notes": [
        "Antes de promover, fijar una edición pública y un localizador más estable que el párrafo de una transcripción digital.",
        "No atribuir el consumo, gusto o conocimiento enológico de Fortunato a Edgar Allan Poe."
      ],
      "status": "candidate_generated"
    },
    {
      "drink_name_candidate": "Médoc",
      "relationship_type_candidate": "appears_in_work",
      "work_candidate": "The Cask of Amontillado",
      "claim_candidate": "En las catacumbas, Montresor ofrece a Fortunato una botella de Médoc y le dice que el vino lo protegerá de la humedad.",
      "why_it_matters": "La escena muestra un segundo vino concreto dentro del mismo descenso y refuerza que el alcohol forma parte de la estrategia narrativa de Montresor, no de una biografía del autor.",
      "confidence_candidate": "medium",
      "sources": [
        {
          "url": "https://www.gutenberg.org/cache/epub/1063/pg1063-images.html",
          "title": "The Cask of Amontillado",
          "author_or_publisher": "Edgar Allan Poe / Project Gutenberg",
          "publication_date": null,
          "source_tier_candidate": "primary",
          "support_excerpt": "A draught of this Medoc will defend us from the damps.",
          "locator": "Texto digital, pasaje de las catacumbas posterior a la tos de Fortunato.",
          "accessed_at": "2026-07-21"
        }
      ],
      "contradicting_evidence": [],
      "verification_notes": [
        "Confirmar en una edición verificable la grafía y el localizador del pasaje antes de promover.",
        "Es una aparición secundaria frente al amontillado; evaluar si tiene suficiente peso editorial para una recomendación independiente."
      ],
      "status": "candidate_generated"
    },
    {
      "drink_name_candidate": "Whisky",
      "relationship_type_candidate": "author_documented",
      "work_candidate": null,
      "claim_candidate": "Una recopilación especializada reproduce el recuerdo tardío de Robert D'Unger, quien dijo haber visto a Poe beber un whisky y agregó que creía que era su bebida favorita.",
      "why_it_matters": "Es una pista biográfica concreta, pero su carácter retrospectivo y la fórmula dubitativa del testigo impiden describir el whisky como preferencia comprobada de Poe.",
      "confidence_candidate": "low",
      "sources": [
        {
          "url": "https://www.eapoe.org/geninfo/poealchl.htm",
          "title": "Edgar Allan Poe, Drugs, and Alcohol",
          "author_or_publisher": "Edgar Allan Poe Society of Baltimore",
          "publication_date": null,
          "source_tier_candidate": "scholarly",
          "support_excerpt": "drank off a big whiskey, (I believe this was his favorite tipple)",
          "locator": "Sección “Poe and Alcohol”, pasaje que atribuye el recuerdo a Robert D'Unger en 1899 y remite a The Poe Log, p. 628.",
          "accessed_at": "2026-07-21"
        },
        {
          "url": "https://research.hrc.utexas.edu/fasearch/pdf/00109.pdf",
          "title": "Edgar Allan Poe, 1809-1849: Manuscript Collection MS-03283",
          "author_or_publisher": "Harry Ransom Center, The University of Texas at Austin",
          "publication_date": null,
          "source_tier_candidate": "scholarly",
          "support_excerpt": "an ongoing problem with alcohol made it difficult",
          "locator": "Página 3 del instrumento de descripción de la colección; referencia bibliográfica a Kenneth Silverman.",
          "accessed_at": "2026-07-21"
        }
      ],
      "contradicting_evidence": [
        {
          "claim": "La fuente especializada advierte que los recuerdos tardíos y de segunda mano deben tratarse con cautela; el supuesto gusto por el whisky no está demostrado por una fuente primaria aquí revisada.",
          "sources": [
            {
              "url": "https://www.eapoe.org/geninfo/poealchl.htm",
              "title": "Edgar Allan Poe, Drugs, and Alcohol",
              "author_or_publisher": "Edgar Allan Poe Society of Baltimore",
              "publication_date": null,
              "source_tier_candidate": "scholarly",
              "support_excerpt": "Second hand accounts may generally be dismissed as hearsay.",
              "locator": "Sección “Poe and Alcohol”, advertencia sobre testimonios y recuerdos retrospectivos.",
              "accessed_at": "2026-07-21"
            }
          ]
        }
      ],
      "verification_notes": [
        "Consultar The Poe Log, p. 628, y establecer el contexto, procedencia y fecha del recuerdo de D'Unger.",
        "No usar “bebida favorita”, ni asociar el whisky con la causa de muerte de Poe, sin corroboración independiente de mayor calidad.",
        "Si no se confirma la fuente primaria o una biografía académica, rechazar este candidato en lugar de rebajar el estándar."
      ],
      "status": "candidate_generated"
    },
    {
      "drink_name_candidate": "Absenta",
      "relationship_type_candidate": "author_documented",
      "work_candidate": null,
      "claim_candidate": "La asociación de Poe con la absenta aparece como un mito biográfico posterior, no como consumo documentado en la evidencia revisada.",
      "why_it_matters": "Conservar esta asociación evita que una leyenda comercial o cultural se convierta en una recomendación biográfica; no debe publicarse como vínculo directo.",
      "confidence_candidate": "low",
      "sources": [
        {
          "url": "https://www.eapoe.org/geninfo/poealchl.htm",
          "title": "Edgar Allan Poe, Drugs, and Alcohol",
          "author_or_publisher": "Edgar Allan Poe Society of Baltimore",
          "publication_date": null,
          "source_tier_candidate": "scholarly",
          "support_excerpt": "not a single shred of documentation ... is given",
          "locator": "Sección “Poe and Absinthe”, discusión de una afirmación difundida por Barnaby Conrad III.",
          "accessed_at": "2026-07-21"
        }
      ],
      "contradicting_evidence": [
        {
          "claim": "La misma fuente identifica el relato de Poe, Hirst, absenta y brandy como una afirmación sin documentación ni fuente identificada.",
          "sources": [
            {
              "url": "https://www.eapoe.org/geninfo/poealchl.htm",
              "title": "Edgar Allan Poe, Drugs, and Alcohol",
              "author_or_publisher": "Edgar Allan Poe Society of Baltimore",
              "publication_date": null,
              "source_tier_candidate": "scholarly",
              "support_excerpt": "A new myth has been added to the story of Poe’s troubles with alcohol.",
              "locator": "Sección “Poe and Absinthe”, introducción a la atribución de absenta.",
              "accessed_at": "2026-07-21"
            }
          ]
        }
      ],
      "verification_notes": [
        "Marcar myth_risk y no promover esta relación como consumo de Poe.",
        "Si se investiga el origen, revisar directamente Absinthe: History in a Bottle, p. 98, y los recuerdos de John Sartain citados por la fuente especializada.",
        "No usar lenguaje que romantice sufrimiento, alcohol o una supuesta creatividad inducida."
      ],
      "status": "candidate_generated"
    }
  ],
  "queries_used": [
    "Edgar Allan Poe The Cask of Amontillado full text amontillado Project Gutenberg",
    "Edgar Allan Poe The Cask of Amontillado Medoc full text",
    "site:eapoe.org Edgar Allan Poe alcohol myth biography",
    "site:poemuseum.org Edgar Allan Poe alcohol myth drinking biography",
    "Edgar Allan Poe biography alcoholism myth scholarly source",
    "Edgar Allan Poe whiskey favorite tipple source",
    "Edgar Allan Poe absinthe myth source",
    "Edgar Allan Poe death alcohol theory archive biography"
  ],
  "unresolved_questions": [
    "¿Qué edición estable de The Cask of Amontillado se usará para fijar capítulo, página o párrafo público de las escenas de amontillado y Médoc?",
    "¿Qué contexto y procedencia tiene exactamente el recuerdo de Robert D'Unger reproducido en The Poe Log, p. 628?",
    "¿Existe una biografía académica accesible que corrobore o descarte el whisky como consumo de Poe sin transformarlo en preferencia?",
    "La absenta debe mantenerse como mito refutado salvo que aparezca documentación primaria o especializada que cambie esta evaluación."
  ],
  "stop_reason": "Se completaron cuatro rondas de búsqueda. Se conservan cuatro candidatos sin aprobación: dos apariciones textuales de vino y dos pistas biográficas de baja confianza, una de ellas marcada explícitamente como mito."
}
