{
  "author_id": "william-faulkner",
  "run": {
    "model": "gpt-5.6-terra",
    "reasoning_effort": "low",
    "executed_at": "2026-07-21T04:20:33Z",
    "search_rounds": 4
  },
  "candidates": [
    {
      "drink_name_candidate": "Whiskey",
      "relationship_type_candidate": "author_documented",
      "work_candidate": null,
      "claim_candidate": "En una sesión pública de 1957, Faulkner recordó que él, Sherwood Anderson y otra persona bebían whiskey por las noches en Nueva Orleans.",
      "why_it_matters": "Es un recuerdo en primera persona conservado por un archivo universitario; documenta consumo en un contexto concreto, sin convertirlo en preferencia ni en rasgo celebratorio.",
      "confidence_candidate": "high",
      "sources": [
        {
          "url": "https://faulkner.lib.virginia.edu/display/wfaudio10.html",
          "title": "Transcript of audio recording wfaudio10",
          "author_or_publisher": "William Faulkner / University of Virginia",
          "publication_date": "1957-04-30",
          "source_tier_candidate": "primary",
          "support_excerpt": "the madam would supply the whiskey, and we would drink",
          "locator": "30 April 1957, University of Virginia, transcripción wfaudio10; pasaje sobre Sherwood Anderson en Nueva Orleans.",
          "accessed_at": "2026-07-21"
        }
      ],
      "contradicting_evidence": [],
      "verification_notes": [
        "Reproducir o abrir la transcripción desde el archivo de la University of Virginia antes de promover; el servidor devolvió 403 al abrirla directamente durante esta búsqueda.",
        "Mantener la afirmación limitada a ese recuerdo y ese contexto; no usarla para afirmar que el whiskey fue su bebida favorita."
      ],
      "status": "candidate_generated"
    },
    {
      "drink_name_candidate": "Hot toddy",
      "relationship_type_candidate": "appears_in_work",
      "work_candidate": "The Sound and the Fury",
      "claim_candidate": "En The Sound and the Fury, el tío Maury ofrece preparar un toddy para Caroline Compson cuando ella está preocupada.",
      "why_it_matters": "La bebida aparece de forma explícita en una escena identificable de la novela; la relación pertenece a los personajes y no prueba un hábito de Faulkner.",
      "confidence_candidate": "high",
      "sources": [
        {
          "url": "https://www.gutenberg.org/files/75170/75170-h/75170-h.htm",
          "title": "The Sound and the Fury",
          "author_or_publisher": "William Faulkner / Project Gutenberg",
          "publication_date": null,
          "source_tier_candidate": "primary",
          "support_excerpt": "I'll make you a toddy.",
          "locator": "Primera sección (Benjy), párrafos iniciales; líneas 74-80 de la edición HTML de Project Gutenberg.",
          "accessed_at": "2026-07-21"
        }
      ],
      "contradicting_evidence": [],
      "verification_notes": [
        "Confirmar el capítulo o la paginación de la edición que se elija para publicación.",
        "No atribuir el toddy a una preferencia de Faulkner ni presentar una receta como histórica."
      ],
      "status": "candidate_generated"
    },
    {
      "drink_name_candidate": "Mint julep",
      "relationship_type_candidate": "appears_in_work",
      "work_candidate": "The Sound and the Fury",
      "claim_candidate": "En el monólogo de Quentin de The Sound and the Fury se menciona que el abuelo de Gerald recogía menta y preparaba su propio julep.",
      "why_it_matters": "El pasaje nombra la bebida y un ritual de preparación dentro de la ficción; ofrece una relación textual distinta de las atribuciones biográficas repetidas sobre Faulkner.",
      "confidence_candidate": "high",
      "sources": [
        {
          "url": "https://www.gutenberg.org/files/75170/75170-h/75170-h.htm",
          "title": "The Sound and the Fury",
          "author_or_publisher": "William Faulkner / Project Gutenberg",
          "publication_date": null,
          "source_tier_candidate": "primary",
          "support_excerpt": "always gathered it himself and made his own julep",
          "locator": "Segunda sección (Quentin), monólogo sobre el abuelo de Gerald; líneas 2809-2810 de la edición HTML de Project Gutenberg.",
          "accessed_at": "2026-07-21"
        }
      ],
      "contradicting_evidence": [
        {
          "claim": "Fuentes populares llaman al mint julep el cóctel favorito de Faulkner, pero las localizadas no identifican un documento primario o una biografía con localizador verificable.",
          "sources": [
            {
              "url": "https://www.openculture.com/2011/12/drinking_with_william_faulkner.html",
              "title": "Drinking with William Faulkner: The Writer Had a Taste for The Mint Julep & Hot Toddy",
              "author_or_publisher": "Open Culture",
              "publication_date": "2011-12-29",
              "source_tier_candidate": "discovery_only",
              "support_excerpt": "His favorite cocktail was the mint julep.",
              "locator": "Párrafo que atribuye una preferencia sin dar localizador biográfico verificable.",
              "accessed_at": "2026-07-21"
            }
          ]
        }
      ],
      "verification_notes": [
        "No promover una afirmación biográfica sobre la preferencia de mint julep con la evidencia localizada; conservar bandera myth_risk.",
        "La eventual explicación debe atribuir la bebida al pasaje y a sus personajes, no al autor."
      ],
      "status": "candidate_generated"
    }
  ],
  "queries_used": [
    "William Faulkner \"mint julep\" novel",
    "William Faulkner \"whiskey\" \"The Sound and the Fury\" full text",
    "William Faulkner \"Soldiers' Pay\" whiskey text",
    "William Faulkner Papers letters whisky archive",
    "\"The Sound and the Fury\" \"decanter of whiskey\"",
    "\"The Sound and the Fury\" \"hot toddy\" Faulkner",
    "\"The Sound and the Fury\" \"whiskey\" Faulkner Quentin Jason Dilsey",
    "\"The Sound and the Fury\" \"mint julep\" Faulkner",
    "Dean Faulkner Wells \"hot toddy\" William Faulkner",
    "Dean Faulkner Wells William Faulkner \"mint julep\"",
    "William Faulkner biography alcohol drinking \"mint julep\" Blotner",
    "William Faulkner \"bourbon\" biography Blotner",
    "site:olemiss.edu Faulkner mint julep cup recipe",
    "site:rowanoak.com Faulkner mint julep cup",
    "site:faulkner.lib.virginia.edu Faulkner whiskey",
    "site:mississippihistory.org Faulkner bourbon Blotner"
  ],
  "unresolved_questions": [
    "¿Qué documento primario, inventario institucional o página de una biografía verificable sustenta la repetida atribución del mint julep como preferencia de Faulkner?",
    "¿Qué edición paginada de The Sound and the Fury se usará para reemplazar los localizadores por líneas de la edición digital?",
    "¿La grabación de 30 April 1957 en el archivo de la University of Virginia permite confirmar íntegramente la transcripción y su contexto antes de promoción?"
  ],
  "stop_reason": "Se completaron cuatro rondas de búsqueda. Se conservan tres candidatos sin aprobación ni publicación; la atribución biográfica del mint julep se mantiene como contradicción y riesgo de mito por falta de una fuente primaria o especializada con localizador verificable."
}
