{
  "author_id": "guillermo-cabrera-infante",
  "run": {
    "model": "gpt-5.6-terra",
    "reasoning_effort": "low",
    "executed_at": "2026-07-21T04:35:51Z",
    "search_rounds": 4
  },
  "candidates": [
    {
      "drink_name_candidate": "Agua",
      "relationship_type_candidate": "author_documented",
      "work_candidate": null,
      "claim_candidate": "Durante la entrega del Premio Cervantes de 1998, Miriam Gómez explicó que Guillermo Cabrera Infante necesitaba beber agua de manera continua.",
      "why_it_matters": "Es una observación fechada sobre una necesidad concreta en un acto público, no una afirmación sobre una preferencia de bebida ni sobre un hábito general del autor.",
      "confidence_candidate": "high",
      "sources": [
        {
          "url": "https://elpais.com/diario/1998/04/24/cultura/893368801_850215.html",
          "title": "Enhorabuena, que lo disfrute",
          "author_or_publisher": "Amelia Castilla / EL PAÍS",
          "publication_date": "1998-04-24",
          "source_tier_candidate": "reputable_secondary",
          "support_excerpt": "Cabrera Infante necesitaba beber agua de manera continua",
          "locator": "Párrafo 2 del cuerpo de la noticia; ceremonia del Premio Cervantes en Alcalá de Henares.",
          "accessed_at": "2026-07-21"
        }
      ],
      "contradicting_evidence": [
        {
          "claim": "La misma crónica registra que algunos periodistas supusieron que el vaso contenía un daiquirí u otra bebida exótica; Miriam Gómez lo aclaró como agua.",
          "sources": [
            {
              "url": "https://elpais.com/diario/1998/04/24/cultura/893368801_850215.html",
              "title": "Enhorabuena, que lo disfrute",
              "author_or_publisher": "Amelia Castilla / EL PAÍS",
              "publication_date": "1998-04-24",
              "source_tier_candidate": "reputable_secondary",
              "support_excerpt": "pensaron que se trataría de un daiquiri",
              "locator": "Párrafo 2 del cuerpo de la noticia.",
              "accessed_at": "2026-07-21"
            }
          ]
        }
      ],
      "verification_notes": [
        "Puede sostener una anécdota breve sobre el acto de 1998, pero no debe convertirse en la bebida preferida de Cabrera Infante.",
        "No usar la conjetura de los periodistas como evidencia de consumo de daiquirí."
      ],
      "status": "candidate_generated"
    },
    {
      "drink_name_candidate": "Daiquirí",
      "relationship_type_candidate": "appears_in_work",
      "work_candidate": "Tres tristes tigres",
      "claim_candidate": "La indexación de una edición de Tres tristes tigres registra «daiquirí» entre sus términos; una transcripción no autorizada localiza una escena en la que Vivian bebe su daiquirí.",
      "why_it_matters": "La pista concierne a una bebida de personaje dentro de la vida nocturna narrada, no al consumo de Cabrera Infante. La escena necesita cotejo en una edición autorizada antes de decidir si es suficientemente significativa.",
      "confidence_candidate": "medium",
      "sources": [
        {
          "url": "https://books.google.com.mx/books?id=blDHP2UpfdMC",
          "title": "Tres tristes tigres",
          "author_or_publisher": "Guillermo Cabrera Infante / Fundación Biblioteca Ayacucho",
          "publication_date": "1990",
          "source_tier_candidate": "primary",
          "support_excerpt": "daiquirí",
          "locator": "Índice de términos de Google Books; edición de 377 páginas, ISBN 9789802761159.",
          "accessed_at": "2026-07-21"
        },
        {
          "url": "https://elalmiranteruina.blogspot.com/2009/01/",
          "title": "El almirante ruina: 2009-01",
          "author_or_publisher": "El almirante ruina",
          "publication_date": "2009-01-01",
          "source_tier_candidate": "discovery_only",
          "support_excerpt": "Vivian estaba sola y bebía su daiquirí",
          "locator": "Entrada indexada por el buscador; sin página ni edición verificables.",
          "accessed_at": "2026-07-21"
        }
      ],
      "contradicting_evidence": [
        {
          "claim": "La fuente primaria accesible confirma el término en la obra, pero no expone la escena ni su página; la atribución a Vivian depende de una transcripción de descubrimiento.",
          "sources": [
            {
              "url": "https://books.google.com.mx/books?id=blDHP2UpfdMC",
              "title": "Tres tristes tigres",
              "author_or_publisher": "Guillermo Cabrera Infante / Fundación Biblioteca Ayacucho",
              "publication_date": "1990",
              "source_tier_candidate": "primary",
              "support_excerpt": "daiquirí",
              "locator": "Índice de términos; vista completa no disponible.",
              "accessed_at": "2026-07-21"
            }
          ]
        }
      ],
      "verification_notes": [
        "Cotejar el pasaje en la edición de Fundación Biblioteca Ayacucho o en otra edición autorizada, con página y contexto narrativo.",
        "No presentar el daiquirí como bebida del autor ni como rasgo biográfico.",
        "Marcar myth_risk para cualquier salto desde la Habana nocturna de la novela a un supuesto maridaje biográfico."
      ],
      "status": "candidate_generated"
    },
    {
      "drink_name_candidate": "Ron",
      "relationship_type_candidate": "appears_in_work",
      "work_candidate": "La Habana para un infante difunto",
      "claim_candidate": "Un resultado de texto digital de La Habana para un infante difunto contiene la expresión «ron doméstico» en un recuerdo narrado; el acceso localizado no permite fijar una edición autorizada ni una página.",
      "why_it_matters": "Es una pista textual para investigar una bebida asociada a la ciudad reconstruida por la novela. Por ahora no identifica con seguridad personaje, escena ni relevancia editorial.",
      "confidence_candidate": "low",
      "sources": [
        {
          "url": "https://bibliotecadigital.tamaulipas.gob.mx/archivos/descargas/79268b7a6_laabanaparauninfantedifunto.PDF",
          "title": "La Habana para un infante difunto",
          "author_or_publisher": "Guillermo Cabrera Infante / Biblioteca Digital Tamaulipas",
          "publication_date": null,
          "source_tier_candidate": "discovery_only",
          "support_excerpt": "o tal vez de ron doméstico",
          "locator": "Resultado de búsqueda dentro del PDF; edición y página no verificadas.",
          "accessed_at": "2026-07-21"
        }
      ],
      "contradicting_evidence": [],
      "verification_notes": [
        "Tratar el PDF sólo como pista: comprobar derechos, edición y página en una copia autorizada antes de abrir o reutilizar el pasaje.",
        "Identificar quién recuerda el ron y el contexto completo; no inferir consumo autobiográfico porque la novela trabaja con memoria y narrador.",
        "Si no se logra un localizador autorizado, rechazar este candidato."
      ],
      "status": "candidate_generated"
    }
  ],
  "queries_used": [
    "\"Tres tristes tigres\" ron Cabrera Infante",
    "\"Tres tristes tigres\" whisky \"Cabrera Infante\"",
    "site:cervantesvirtual.com \"Tres tristes tigres\" ron",
    "\"Guillermo Cabrera Infante\" ron entrevista memorias",
    "\"Tres tristes tigres\" \"daiquirí\"",
    "\"Tres tristes tigres\" \"ron\" \"daiquirí\"",
    "\"La Habana para un infante difunto\" ron \"Cabrera Infante\"",
    "\"Guillermo Cabrera Infante\" \"daiquirí\""
  ],
  "unresolved_questions": [
    "¿En qué página y con qué contexto aparece el daiquirí de Vivian en una edición autorizada de Tres tristes tigres?",
    "¿La aparición de ron en La Habana para un infante difunto puede verificarse en una edición autorizada con personaje y localizador?",
    "¿Existen cartas, entrevistas o memorias primarias que documenten una bebida alcohólica concreta de Cabrera Infante sin confundirla con la atmósfera de sus novelas?",
    "¿La aparición narrativa de daiquirí es suficientemente central para una recomendación, o corresponde conservarla sólo como evidencia de ambientación?"
  ],
  "stop_reason": "Se completaron cuatro rondas de búsqueda. Se conservan tres candidatos sin aprobación ni publicación: una anécdota documentada de agua que descarta una identificación periodística de daiquirí, una aparición de daiquirí en Tres tristes tigres pendiente de cotejo autorizado y una pista de ron en La Habana para un infante difunto sin localizador verificable. No se encontró evidencia suficiente para atribuir una bebida alcohólica preferida a Guillermo Cabrera Infante."
}
